sentence,words
¿No usarás este mes la suscripción de Netflix?,usarás
"Si vas a confiar en el castigo para cambiar una conducta, entonces la fuerza del castigo debe corresponder relativamente a la fuerza de la conducta que estás tratando de corregir.",corresponder
"Porque el éxito, al igual que la felicidad, no puede perseguirse, debe surgir por sí mismo, y esto solo sucede como un efecto secundario de la dedicación personal a la búsqueda de algo más grande que uno mismo o como un subproducto de nuestra rendición ante una persona distinta a nosotros».",dedicación
El constante uso del pretexto «solo un minuto más» puede evitar que hagamos algo importante.,pretexto
•	Llega un mensaje de texto a tu celular.,Llega
"Tan hermosa, de  hecho, que él inmediatamente se dio cuenta de cuán fuera  de lugar se veía rodeada por el resto de sus humildes posesiones.",humildes
"Cuando alcancé esa meta, le conté a mis padres y a mi novia.",conté
"Reddit, 5 de junio 2017, https://www.reddit.com/r/get disciplined/com ments/6fgqbv/question_what_one_habit_ iterally_changed_your/ diieswq [(Pregunta) ¿Qué único hábito literalmente cambió tu vida?",disciplined
"Si tenían éxito, estarían logrando el CBE.4 De manera similar al equipo de ciclismo británico del que hablamos en el Capítulo 1, los Lakers buscaban el desempeño máximo tratando de ser un poco mejores cada día.",buscaban
"Hay una antigua parábola griega conocida como la paradoja de sorites,* que se refiere al efecto que una pequeña acción puede tener cuando se repite suficientes veces.",sorites
"En cierto sentido, un hábito es solamente un obstáculo para que obtengas lo que realmente quieres.",obtengas
"10	Kelly McGonigal, The Upside of Stress: Why Stress Is Good for You, and How to Get Good at It, Nueva York, Avery, 2016, xv [Estrés: el lado bueno.",Kelly
"A pesar de que tenemos personalidades únicas, ciertas conductas tienden a generarse una y otra vez bajo ciertas condiciones del ambiente.",personalidades
"Cuando carezcas de una ventaja genética o de años para poder practicar, puedes tomar un atajo reescribiendo las reglas para ti mismo.",carezcas
"Inmediatamente después, pasaba un clip de la taza llena a la taza vacía y el proceso comenzaba de nuevo.",clip
Con frecuencia puedes descubrir los hábitos umbral que te conducirán al resultado deseado clasificando tus metas con una escala que vaya de lo «muy sencillo» a lo «muy difícil».,conducirán
¿Dejaste de comprar un café por la mañana?,Dejaste
"El ser específico acerca de lo que quieres y cómo vas a obtenerlo te ayuda a decir no a las cosas que te desvían del progreso, que distraen tu atención y que te sacan de curso.",obtenerlo
"Sarah E. Jackson, Rebecca J. Beeken, Jane Wardle, «Perceived weight discrimination and changes in weight, waist circumference, and weight status», Obesity, 2014, doi:10.1002/",Jackson
"Nunca me consideré especialista en el tema, por el contrario, me parecía que era alguien que estaba apenas experimentando y aprendiendo junto con mis lectores.",consideré
"Como ejemplo, digamos que Magic Johnson —el jugador estrella de los Lakers en aquella época— tenía 11 puntos, 8 rebotes, 12 asistencias, 2 robos y 5 rotaciones en un juego.",asistencias
"4	«John H. Patterson-:ringing up success with the incorruptible cashier», Dayton Innovation Legacy, http:// www.daytoninnovationlegacy.org/patterson.html, fecha de consulta 8 de junio 2016 [John Patterson: Tocando el timbre del éxito con la caja registradora incorruptible].",cashier
Brailsford y los entrenadores a su cargo comenzaron a hacer pequeños ajustes en diversos aspectos que podían esperarse de un equipo profesional.5 Empezaron por rediseñar los asientos de las bicicletas para hacerlos más cómodos y aplicaron alcohol a las ruedas para darles una mejor tracción.,esperarse
"4	Amy A. Gorin et al., «Randomized controlled trial examining the Ripple Effect of a nationally available weight management program on untreated spouses», Obesity 26, núm. 3, 2018, doi:10.1002/oby.22098 [Estudio aleatorio controlado para examinar el efecto Ripple en un programa nacional vigente de control de peso en cónyuges que no están bajo tratamiento].",Gorin
Ellos obtendrían su calificación con base en la excelencia de su trabajo.,obtendrían
"Existen muchas maneras de convencer al electorado de votar en una democracia, pero tal cambio de conducta no tendría efecto en una dictadura.",electorado
Enseñamos a los alumnos lo que necesitan para aprobar pruebas estandarizadas en lugar de ayudarlos a aprender y a desarrollar la curiosidad y el pensamiento crítico.,Enseñamos
"1	Twyla Tharp y Mark Reiter, The Creative Habit: Learn It and Use It for Life: A Practical Guide, Nueva York, Simon and Schuster, 2006 [El hábito creativo: Apréndelo y úsalo de por vida].",Reiter
Tú no estás condenado a ser una víctima de tu ambiente.,condenado
"•	Cada vez que empiezas a entrenar, eres un atleta.",empiezas
Comencé a sentirme seguro nuevamente y a creer en  mí.,Comencé
"Cuando los científicos analizan a las personas que aparentemente tienen un enorme autocontrol, resulta que esos individuos no son para nada distintos a las personas que tienen que luchar por autocontrolarse.",autocontrolarse
◆	No rompas la cadena.,rompas
"Igual que una moneda no te volverá rico, un cambio positivo como meditar por un minuto o leer una página por día no producirá una diferencia notable.",volverá
"8	William H. Gladstones, Michael A. Regan, Robert B. Lee, «Division of attention: The single-channel hypothesis revisited», Quarterly Journal of Experimental Psychology Section A 41, núm. 1 (1989), doi:10.1080/14640748908402350 [La división de la atención: Revisión de la hipótesis del canal único].",Gladstones
¿Gastas menos de lo que ganas cada mes?,Gastas
"Una vez que domines esta estructura básica, podrás empezar a crear conjuntos más grandes al encadenar varios hábitos.",conjuntos
"Tú sabes que la meta real es realizar el hábito más de dos minutos, así que podría parecer que estás tratando de engañarte a ti mismo.",engañarte
"Cuando eres adulto, soñar despierto acerca de tus siguientes vacaciones puede ser más disfrutable que estar realmente de vacaciones.",vacaciones
Los pequeños hábitos no se suman.,suman
"Más aún, el historial de hábitos provee pruebas visibles de que estás reuniendo puntos para convertirte en la clase de persona que deseas ser, lo cual es una maravillosa forma de gratificación* inmediata e intrínseca.",maravillosa
"Para cuando entró a la preparatoria, su material se había expandido hasta incluir un  acto de cinco minutos y, unos años después, tenía ya un espectáculo de diez minutos.",expandido
"Cómo construir productos y servicios exitosos que formen hábitos, Sunshine Business Development, 2014.",formen
•	Vestirme,Vestirme
"Cada uno de los presidentes que estaban participando en las negociaciones tenía acceso a códigos que de activarse podían matar a millones de personas; sin embargo, ninguno de ellos los vería morir porque siempre estarían a miles de kilómetros de distancia.",códigos
"Asumiendo que viajes en un 747 o en un avión A380, si cambias la dirección 3.5 grados cuando despegas de Los Ángeles, el frente del avión se movería aproximadamente 2 metros.",viajes
"Como regla general, entre más placer inmediato obtengas a partir de una acción, más debes cuestionarte si dicha acción está alineada con tus metas a largo plazo.",cuestionarte
", «A primer on foraging and the explore/exploit trade-off for Psychiatry research», Neuropsychopharmacology 42, núm. 10, 2017, doi:10.1038/npp.2017.108 [Un manual sobre la búsqueda de alimento y el intercambio exploración/explotación en el campo de la investigación psiquiátrica].",foraging
"Los profesionales se atienen a un horario, los aficionados dejan que la vida se entrometa en el camino.",atienen
Es fácil no tomar tus vitaminas cuando están fuera de la vista dentro de la alacena.,alacena
Los ejecutantes destacados en todos los campos se comprometen con diferentes tipos de reflexión y revisión.,ejecutantes
Los humanos somos animales gregarios.,gregarios
"(Para empezar, uno compite en tierra y el otro en agua).",compite
¿El sillón era para relajarme o para enviar correos electrónicos?,relajarme
"En el verano de 1986, diseñó un plan para lograr exactamente eso, un sistema que llamó CBE (Mejor Esfuerzo para una Carrera).3",CBE
"Al hacer el mismo calentamiento antes de cada sesión de ejercicios, haces que te sea más sencillo alcanzar el pico máximo de desempeño.",calentamiento
Es mejor llevar un historial consistente de un solo hábito que registrar diez de manera esporádica.,esporádica
"Cada vez que repites una acción, estás activando un circuito neuronal específico que está asociado con ese hábito.",activando
"8	Saul_Panzer_NY, «[Question] What",Question
"Abbotsford era  un suburbio relativamente pequeño, escondido a la sombra del cercano Vancouver, donde la mayoría de los grandes negocios se realizaban.",Vancouver
"De la misma manera en que los átomos son los ladrillos de las moléculas, los hábitos atómicos son los ladrillos de los resultados excepcionales.",excepcionales
Las preguntas obvias son: «¿Cómo puedo descubrir cuáles son las posibilidades que juegan a mi favor?,juegan
"Ese mismo año, Bradley Wiggins se convirtió en el primer ciclista británico en ganar el Tour de France.9 En 2013, su compañero de equipo, Chris Froome, ganó la carrera y repitió la hazaña en 2015, 2016 y 2017, lo cual dio al equipo británico cinco victorias en el Tour de France en seis años.10",repitió
Las águilas tienen una extraordinaria visión de larga distancia.,águilas
Casi 75% de los sujetos eligieron la opción incorrecta por lo menos en una ocasión.,eligieron
"Me refiero a que, aceptémoslo, el yo presente está presente.",aceptémoslo
Nadar contra la corriente del ambiente en el que te desenvuelves requiere un esfuerzo adicional.,Nadar
"Cuando se trata de desarrollar nuevos hábitos, puedes usar esta interconexión entre conductas a tu favor.",interconexión
"De hecho, era eso en lo único en que creía y rechazaba por completo la idea del talento innato.",rechazaba
Los investigadores han descubierto que incluso la asistencia a las urnas se incrementa5 cuando la gente es forzada a crear intenciones de implementación contestando preguntas como «¿Qué ruta planea usar para acudir a la casilla de votación?,urnas
Todos los aciertos de esta obra deben atribuirse al genio de los muchos expertos que me precedieron.,aciertos
"Siempre las tienes presentes, aun cuando no ocupen el lugar principal en tu mente.",ocupen
Lo que haces es un indicador del tipo de persona que crees que eres —independientemente de que esto se dé a nivel consciente o inconsciente—.,dé
La meditación es un obstáculo para sentirte tranquilo.,tranquilo
"Piso 2, Polanco V Sección, Miguel Hidalgo",Polanco
"Después se da una respuesta, pero la recompensa no llega tan rápido como se esperaba y la dopamina comienza a bajar.",llega
"Cuando el gobierno británico quiso elevar sus tasas de recolección de impuestos, en lugar de enviar a los ciudadanos a una página web desde donde se podía bajar el formato para el pago de impuestos, les daban un vínculo que los llevaba directamente al formato.",quiso
cit.,cit
La tasa de diarrea disminuyó 52%;,disminuyó
Wendy Berry Mendes y Jeremy Jamieson han conducido una serie de estudios que muestran que la gente se desempeña mejor cuando decide interpretar la aceleración de sus latidos y el ritmo de su respiración como un recurso que las ayuda a desempeñarse mejor.,Berry
"La manicurista dijo incluso que, fuera del hecho de que los bordes estaban mordidos, yo tenía unas uñas realmente sanas y atractivas.",mordidos
"Siempre que experimentas algo de manera repetida —como la paramédica que vio el rostro de un paciente a punto de sufrir un ataque cardíaco o un analista militar que observa un misil en la pantalla de un radar—, tu cerebro comienza por analizar qué es lo más importante, clasifica los detalles, destaca las señales relevantes y cataloga la información para usarla en el futuro.",cataloga
Salir de casa (tratar de dar un paseo caminando).,Salir
"Sin embargo, si detectas una señal y esperas la recompensa, pero no la obtienes, entonces la dopamina baja para mostrar decepción (C).",detectas
"Al final, tenían poco que mostrar como resultado de su esfuerzo, excepto algunas teorías que no podían verificarse y una foto mediocre.*1",verificarse
Estoy en deuda con Blake Atwood y Robin Dellabough por transformar mis horribles y absurdamente largos primeros bosquejos y convertirlos en manuscritos certeros y legibles.,Atwood
Construir mejores hábitos no consiste en desperdiciar tu día en descubrir técnicas ingeniosas para hacer tu vida más fácil.,desperdiciar
tu cerebro aprenderá las señales que predicen ciertos resultados sin que tengas que pensar en ello de manera consciente.,aprenderá
"18	Wolfram Schultz, «Multiple reward signals in the brain», Nature Reviews Neuroscience 1, núm. 3, 2000, doi:10.1038/35044563 [Múltiples señales de recompensa en el cerebro].",Multiple
Preparas las recetas de tu chef pastelero favorito.,Preparas
El mensaje que debes llevarte consiste en que es importante desarrollar hábitos que funcionen para tu personalidad.,llevarte
Problema 2: Alcanzar una meta consiste únicamente en un cambio momentáneo,momentáneo
La acumulación de hábitos aumenta la posibilidad de que mantengas un hábito positivo al sumar una nueva conducta a una conducta anterior.,sumar
"•	Tú crees que estás renunciando a algo, pero no estás renunciando a nada porque los cigarros no hacen nada por ti.",renunciando
El porno online empalma escenas estimulantes a una velocidad que jamás podríamos replicar en la vida real.,porno
La máquina automáticamente encerraba el dinero y los recibos que había dentro de ella al terminar cada transacción.,encerraba
"En otras palabras, las personas que son más sensibles a las señales negativas de su ambiente son más propensas a tener un alto puntaje en neuroticismo.",propensas
"Pero luego, conforme el hábito se vuelve automático, te vuelves menos sensible a la retroalimentación.",vuelves
20 El inconveniente de crear buenos hábitos,crear
"A la edad de 14 años, era la campeona del mundo y, unos años después, se convirtió en gran maestra.",campeona
También corrieron con la suerte de estar en el ambiente ideal para desarrollar y sacar provecho de sus habilidades.,corrieron
Frecuentemente descartamos los pequeños cambios porque no parecen importar mucho en un momento dado.,descartamos
El dolor que produce el fracaso es directamente proporcional al tamaño de las expectativas.,proporcional
"Podría apostar que si cualquier persona promedio realizara simplemente la mitad de estas acciones una vez en la vida —aun si no le dedicara otro pensamiento al desarrollo de sus hábitos—, se encontraría viviendo una mejor vida dentro de un año.",apostar
"12	Ian Mcdougall, Francis H. Brown, John G. Fleagle, «Stratigraphic placement and age of modern humans from Kibish, Ethiopia», Nature 433, núm. 7027, 2005, doi:10.1038/nature03258 [Ubicación estratigráfica y edad de los humanos modernos de Kibish, Etiopía].",Ian
"Como podían observar su medidor con frecuencia y el uso de energía era evidente y fácil de seguir, la gente cambiaba su conducta y usaba menos electricidad.9",cambiaba
La reflexión y la revisión son el antídoto.,antídoto
"•	Cada vez que tocas el violín, eres un músico.",tocas
"», Psychoneuroendocrinology 38, núm. 11, 2013, doi:10.1016/j.psyneuen.2013.05.006 [El estado de ánimo negativo inducido por estrés modera la relación entre la administración de oxitocina y la confianza].",Psychoneuroendocrinology
Se trataba de un nuevo comienzo y la universidad era el lugar donde descubriría el poder de los pequeños hábitos.,descubriría
"El teniente tomó la decisión correcta, pero incluso sus superiores no sabían explicar cómo lo había hecho.",sabían
Cada ser viviente tiene sus propios métodos para percibir y entender el mundo.,viviente
Cualquiera que haya intentado meditar durante más de tres segundos sabe lo frustrante que es cuando la siguiente distracción brota en tu mente de manera inevitable.,intentado
"Tus hábitos actuales se han internalizado en el curso de cientos, si no miles de repeticiones.",internalizado
"Entre más dominas una habilidad específica, más difícil es para los demás competir en contra tuya.",competir
"Los genes han demostrado ser una influencia en todo, desde el número de horas que pasas frente al televisor hasta las posibilidades de que te cases o te divorcies, pasando por tu tendencia a ser adicto a las drogas, el alcohol o la nicotina.8 Hay un fuerte componente genético que determina cuán obediente o rebelde eres frente a la autoridad, cuán vulnerable o resistente eres ante acontecimientos estresantes, cuán proactivo o reactivo tiendes a ser e, incluso, cuán cautivado o aburrido te puedes sentir ante experiencias sensoriales como asistir a un concierto.9 Como me lo explicó Robert Plomin, un genetista del King´s College de Londres: «Hemos llegado al punto en que dejamos de investigar si ciertos rasgos de la personalidad tienen un componente genético porque literalmente no hemos podido encontrar uno solo que no esté influenciado por nuestros genes».10",cases
Estamos limitados por los caminos a donde nos conducen nuestros hábitos.,limitados
Son el canal a través del cual desarrollas y cultivas las creencias más profundas acerca de ti mismo.,profundas
"Él quería que los Lakers jugaran al máximo de su potencial, noche a noche.",jugaran
"A continuación, verás la representación gráfica de los resultados que obtienen los investigadores cuando miden el nivel de automaticidad de un hábito real como caminar durante diez minutos diariamente.",miden
La única manera de progresar —la única opción que tuve— consistió en comenzar por dar pasos pequeños.,progresar
"Después de limpiar la mesada, dejaré preparada mi taza de café para la mañana siguiente.",dejaré
Tu sistema de BÚSQUEDA podría no estar funcionando: Una conversación con el neurocientífico Jaak Panksepp].,neurocientífico
"Sin embargo, su trabajo no se desperdició.",desperdició
"Después de unas semanas, empezó a ver a su alrededor y pensó: «Bueno, siempre vengo a este lugar de todas formas.",pensó
"Cuando el esfuerzo requerido para actuar según tus deseos equivale a cero de manera efectiva, puedes caer presa de cualquier impulso que se presente en un momento dado.",presa
Apéndice.,Apéndice
Pero tal vez notes que tu piel se ve mejor o que eres capaz de despertar más temprano o que tus impulsos sexuales han aumentado.,notes
"En YouTube está disponible su inspiradora charla The Surprising Power of Small Habits, de la SNAPS Leadership Conference.",YouTube
"Una vez que has adoptado una identidad, es fácil que tu lealtad hacia ella influya en tu capacidad para cambiar.",influya
"La meta de cualquier equipo deportivo es obtener el mejor resultado, pero sería absurdo pasarse el partido viendo el marcador.",marcador
"Cómo los grandes líderes nos inspiran a actuar, Barcelona, Península, 2013].",inspiran
"Por el contrario, si te atienes al hábito de hacer una lagartija a diario, eso no requiere prácticamente ningún esfuerzo para empezar.",atienes
"Cuando las palancas están en una posición incorrecta, es casi imposible lograrlo.",incorrecta
", «Serotonergic versus Nonserotonergic dorsal raphe projection neurons: Differential participation in reward circuitry», Cell Reports 8, núm. 6, 2014, doi:10.1016/j.celrep.2014.08.037",Serotonergic
"El neurocientífico Antonio Damasio lo explica de la siguiente manera: «La emoción es lo que hace que etiquetemos las cosas como buenas, malas o indiferentes».3",etiquetemos
"Publishing Group, una división de Penguin Random House LLC.",Publishing
"La mejora no se trata solamente de aprender hábitos, también se trata de afinarlos.",afinarlos
"Una vez que tu orgullo se involucra, naturalmente luchas con uñas y dientes para mantener tus hábitos.",luchas
"Es conferencista en universidades de todo el mundo, orador habitual de Fortune 500 y consultor de la NFL, NBA y MLB.",conferencista
Todos queremos ver toda la cadena montañosa sin obsesionarnos con cada cima y cada valle.,montañosa
"Después de dar gracias por lo que sucedió, voy a leer los periódicos (lo que quiero).",periódicos
Pequeñas lecciones de las cuatro leyes,Pequeñas
"Nunca cambian la manera como se conciben a sí mismas, y no se dan cuenta de que su vieja identidad puede sabotear sus planes de cambiar.",conciben
"El sistema democrático está fundamentado en creencias como la libertad, el poder de la mayoría y la igualdad social.",democrático
"Si logras apegarte a esta estrategia, cada contexto quedará asociado con un hábito particular y un modo de pensamiento.",apegarte
"una cantidad extremadamente pequeña de una cosa, la unidad más pequeña e irreductible que forma parte de un sistema mayor.",irreductible
10 Cómo localizar y arreglar las causas de tus malos hábitos,causas
Mis más recientes artículos son publicados en mi boletín semanal gratuito.,semanal
"A meta-analysis of the experimental evidence», Psychological Bulletin 142, núm. 2, 2016, doi:10.1037/bul0000025 [¿El monitoreo del progreso en la consecución de objetivos promueve el logro de los mismos?",monitoreo
"Me he beneficiado durante muchos años del apoyo de mis padres, de mis abuelos y mis hermanos.",abuelos
"En nuestro mundo que gira alrededor de los datos y la información, tendemos a sobrevalorar los números y a subestimar cualquier cosa que sea efímera, suave o difícil de cuantificar.",sobrevalorar
—Me parece que la meta de la publicidad de lavarse las manos no consiste en lograr un cambio de conducta sino en adoptar un hábito —dijo Luby—.,publicidad
"Las ideas fundamentales sobre las que cimentamos nuestros negocios, nuestra familia y nuestra vida.",cimentamos
"Para más información véase Solomon E. Asch, «Opinions and social pressure», Scientific American 193, núm. 5, 1955, doi:10.1038/scientificamerican1155-1 [Opiniones y presión social]; William N. Morris, Robert S. Miller, «The effects of consensus-breaking and consensus-preempting partners  on reduction of conformity», Journal of Experimental Social Psychology 11, núm. 3, 1975, doi:10.1016/s0022-031(75)80023-0 [Los efectos de los compañeros de rompimiento de consenso y de prevención de consenso en la reducción de la conformidad].",Opinions
Considero que este principio es tan importante que me voy a atener a él incluso si no puedo realizar el hábito tan bien o tan completo como me gustaría.,Considero
¿A qué me refiero cuando afirmo esto?,afirmo
"Sin el cuarto paso, la conducta no se repetirá.",repetirá
La gente cree con frecuencia que es raro recibir reconocimiento por haber leído una sola página o por meditar durante un minuto o por hacer una llamada de ventas.,raro
Fue entonces cuando los agricultores empezaron a sembrar con anticipación y en espera de una cosecha meses después.,cosecha
"Una vez que entiendes cómo nuestro cerebro prioriza las recompensas, las respuestas se hacen más claras: las consecuencias de los malos hábitos son retardadas mientras las recompensas son inmediatas.",prioriza
"Las tareas viejas se vuelven más sencillas la segunda vez que las realizas, pero en general, el proceso no se simplifica porque siempre estás usando tu energía para enfrentar el siguiente reto.",viejas
Yo no quiero encasillarme en un estilo de vida que no disfruto.,encasillarme
Es difícil imaginar una situación que causara temor a más personas que actuar solo en un escenario y fallar en hacer reír al público.,causara
Tener que matar a alguien distorsionaría el juicio del presidente.,distorsionaría
Se quedó sin nada más que un gran chal.,chal
El reforzamiento inmediato ayuda a mantener la motivación a corto plazo mientras esperas a que las recompensas a largo plazo lleguen.,lleguen
"Y si dejaba de pesarse diariamente, tenía que pagarle 500 dólares para que los usara de la manera en que él considerara conveniente.",considerara
El saber que alguien te está mirando puede ser un motivador muy poderoso.,mirando
Acogen los sentimientos que quieren adormecer.,Acogen
Tú puedes adaptar esta estrategia y aplicarla para casi cualquier propósito.,adaptar
Querían dejar de comer en restaurantes y empezar a cocinar juntos en casa.,Querían
•	«Soy el director ejecutivo» se traduce en «Soy el tipo de persona que construye y que crea cosas».,traduce
Los pequeños hábitos se componen.,componen
El problema con una mentalidad que privilegia las metas es que siempre se pospone la felicidad hasta que se logra alcanzar el siguiente hito.,pospone
"La escultura, que se creía que había sido creada en la Grecia antigua, fue comprada por 10 millones de dólares.",Grecia
"Tu sistema consiste en la frecuencia de tus ensayos, en la manera como divides y practicas los pasajes complicados y en el método para recibir retroalimentación de tu instructor.",ensayos
"Fumar era parte de la vida anterior de la persona, no de su vida actual.",Fumar
"No solamente no estás perdiendo nada y a cambio estás obteniendo estupendas ganancias positivas no solo para tu salud, energía y economía; también estás ganando seguridad en ti mismo, respeto, libertad y, sobre todo, estás alargando y mejorando la calidad de tu vida en el futuro.",alargando
