sentence,words
"18	Frédéric Bastiat y W.B. Hodgson, What Is Seen and What Is Not Seen: Or Political Economy in One Lesson, Londres, Smith, 1859 [Lo que se ve y lo que no se ve: O la política económica en una lección].",Hodgson
"En resumen, el historial de hábitos 1) crea una señal visual que te recuerda que debes actuar, 2) es inherentemente motivante porque te ayuda a ver el progreso que has estado haciendo y que no quieres dejar de hacer y 3) produce un sentimiento de satisfacción registrar otro avance exitoso de tu hábito.",inherentemente
Sentirte motivado es lo que hace que actúes.,actúes
O «Realmente debes querer lograrlo».,Realmente
Rara vez permanecía en escena por más de cinco minutos.,Rara
"7	Shahram Heshmat, «Why do we remember certain things, but forget others», Psychology Today, 8 de octubre 2015, https: //www.psychologytoday.com/us/blog/science-choice/201510/whydoweremember-certain-things-forget-others [Por qué recordamos ciertas cosas y olvidamos otras].",Shahram
Gracias a Peter Guzzardi por guiarme a través de las primeras fases del proceso de escritura y por llamarme la atención cuando realmente hacía falta.,Guzzardi
"Mientras mis compañeros se desvelaban jugando videojuegos, yo desarrollé buenos hábitos de sueño y todas las noches me iba a dormir temprano.",desvelaban
Imagina que tienes una habitación muy sucia y desordenada y que estableces la meta de limpiarla y ordenarla.,ordenarla
Puede parecer una carga porque te obliga a tener dos hábitos de manera simultánea: el hábito que quieres desarrollar y el hábito de llevar un registro del mismo.,simultánea
"Por ejemplo, el ganso común es un ave que anida en tierra firme.",ave
"En resumen, una de las mejores maneras de asegurar que tus hábitos te sigan satisfaciendo a largo plazo, consiste en elegir conductas que son compatibles con tu personalidad y tus habilidades.",satisfaciendo
◆	La cantidad de tiempo que llevas realizando un hábito no es tan importante como el número de veces que has realizado ese hábito.,llevas
El bat me aplastó la cara de tal manera que la nariz se me convirtió en una especie de letra u distorsionada.,aplastó
Por años había conservado mis notas acerca de mis experimentos personales con los hábitos y sentía que estaba listo para compartir algunos en público.,conservado
Acerca del autor,autor
La concreción de la conducta es la señal para ponerla por escrito.,concreción
La siguiente cita del Tao Te Ching encapsula estas ideas perfectamente:,Tao
Están modeladas por tu primera elección.,modeladas
Solamente permite los sentimientos de compromiso y de gozo.,gozo
"La mayoría de la gente prefiere iniciar el cambio durante esos días porque la esperanza alcanza los niveles más altos.8 Si tenemos esperanza, tenemos una razón para realizar la acción.",prefiere
63-73 [Cultura costosa: Las diferencias en la eficiencia para partir nueces entre grupos de chimpancés salvajes].,Cultura
"Si comes un alimento poco saludable hoy, la báscula no va a registrar un cambio muy drástico.",drástico
"Si los científicos reproducen un sonido alto en el cunero del hospital, algunos bebés se voltean hacia el lugar de donde surge el sonido, mientras otros se voltean al lado contrario.",reproducen
"Es durante los días duros cuando es crucial contar con tantas cosas a tu favor como sea posible, de tal manera que puedas vencer los retos que la vida te lanza en forma natural.",vencer
"Incluso si no eres naturalmente dotado, con frecuencia puedes ganar si te conviertes en el mejor de una categoría estrecha.",dotado
"Responde a este mensaje por 5 dólares vía Paypal (el límite son cinco), asumiendo que la alarma no está",Responde
La urgencia de actuar para solucionar el problema se apodera de ti sin que tengas que pensar en ello.,solucionar
"Algunos expertos estiman que la mitad de los recursos del cerebro son usados para ver.8 Dado el hecho de que dependemos más de la vista que de cualquier otro sentido, no debería sorprendernos que las señales visuales sean el mayor catalizador de nuestro comportamiento.",sorprendernos
Demuéstratelo a ti mismo mediante pequeñas victorias continuas.,Demuéstratelo
"Si un fracaso es prácticamente indoloro, se ignora.",indoloro
"18	«How to live a longer, higher quality life, with Peter Attia, M.D.», Investor’s Field Guide, 7 de marzo 2017, http://investorfieldguide.com/attia [Cómo vivir una vida más larga y de alta calidad, con el Dr. Peter Attia].",live
"Las fuentes contaminadas de agua provocaban epidemias de diarrea, vómito y dolor abdominal.",contaminadas
Antoine Bechara et al.,Antoine
El equipo comenzó por cambiar la forma en que las bebidas estaban distribuidas en la cafetería.,distribuidas
El cambio de identidad es la estrella polar que guía el cambio de hábitos.,polar
"•	Cada vez que motivas a tus empleados, eres un líder.",motivas
Es posible encontrar evidencias para cualquier mentalidad o perspectiva que elijamos.,elijamos
"El sentimiento aparece primero (Sistema 1); la racionalidad solo interviene más adelante (Sistema 2).4 Esto funciona perfecto cuando ambos sistemas están sincronizados, pero tiene como resultado pensamientos ilógicos y emocionales cuando no lo están.",racionalidad
"Mientras los doctores se apuraban a suministrarme oxígeno, tomaron la decisión de llevarme a otro hospital que contara con el equipo necesario para controlar una situación tan delicada.",apuraban
Uno de mis lectores y su esposa usaron una estrategia similar.,usaron
Estos son los estímulos supernormales de nuestro mundo moderno.,moderno
"Después de servir como piloto en la Segunda Guerra Mundial, Roger Fisher acudió a la facultad de leyes de Harvard y pasó los siguientes 34 años especializándose en negociación y manejo de conflictos.",facultad
"Pero los rasgos de conducta que reflejan talentos y temperamentos subyacentes sí son heredables: cuán eficiente eres para el manejo del idioma, cuán religioso eres, cuán liberal, cuán conservador.",temperamentos
"Pero, en realidad, solamente estás reforzando tus hábitos actuales, no mejorándolos.",mejorándolos
"En cambio, la concentración de masa de Europa, Asia y el Medio Oriente tiene el aspecto contrario.",Asia
"Entre más evidencia tienes para conformar una creencia, más firmemente creerás en ella.",creerás
"Por el contrario, el cerebro subestima lo que parece ser una amenaza distante pero que es muy probable que ocurra en realidad: la constante acumulación de grasa debido al exceso de comida, un gradual deterioro de los músculos debido a que permanecemos sentados mucho tiempo, la lenta acumulación de desorden cuando no haces la limpieza.",subestima
El estudio mejor documentado de análisis de los rasgos de personalidad se conoce como Big Five [Gran Cinco].,documentado
"Para alguien que raramente apuesta, los tintineos y repiqueteos del casino son solamente un ruido de fondo.",tintineos
Los hábitos atómicos y la mejora gradual son la clave para lograr el cambio de identidad sin perderla.,perderla
Lo que importa es determinar si tus hábitos te están conduciendo hacia el camino del éxito.,conduciendo
"Finalmente, terminarás dominando el hábito que originalmente habías deseado desarrollar mientras sigues manteniendo tu atención donde debe estar: en los primeros dos minutos de la conducta.",dominando
"Shane Parrish, «Avoiding stupidity is easier than seeking brilliance», Farnam Street, junio 2014, https://www.fs.blog/2014/06/avoiding- stupidity [Evitar la estupidez es más sencillo que intentar ser brillante].",Avoiding
Los hábitos son atajos mentales aprendidos gracias a  la experiencia.,aprendidos
Como apuntó Aristóteles: «Es fácil decepcionar a la juventud porque la juventud es rápida para tener esperanzas».8 Tal vez esto podría actualizarse y expresarse como: «Es fácil decepcionar a la juventud porque la juventud solo tiene esperanzas».,actualizarse
Un estímulo supernormal es una versión intensificada de la realidad —como un pico con tres manchas rojas o un huevo del tamaño de una pelota de voleibol— que suscita una respuesta más fuerte que la respuesta normal.,supernormal
El futuro distante es un factor que preocupaba mucho menos.,preocupaba
Seguirás persiguiendo un resultado porque nunca te tomaste el tiempo de cambiar el sistema que está detrás de él.,Seguirás
"Implementation intentions, voter turnout, and organic plan making», Psychological Science 21, núm. 2, 2010: 194-199 [¿Tienes un plan para votar?",organic
Esto te permite tomar ventaja del ímpetu natural que se da cuando una conducta lleva a la siguiente —una versión positiva del efecto Diderot.,ímpetu
"Al poner todo esto en un mismo plano, podrás darte cuenta de que los hábitos son el camino que conduce al cambio de identidad.",podrás
También había dejado de montar.,dejado
POR QUÉ LOS PEQUEÑOS CAMBIOS GENERAN UNA GRAN DIFERENCIA,CAMBIOS
"Con tan solo hacer algo —diez sentadillas, cinco carreras cortas, una lagartija, cualquier cosa en realidad—, estarás haciendo algo enorme.",sentadillas
Puede ser difícil estudiar en la sala sin distraerte si ese es el lugar donde sueles jugar videojuegos.,sueles
"Al esparcir diversas señales a tu alrededor, incrementas las probabilidades de pensar en tu hábito durante el día.",incrementas
"Se trató de una evolución gradual, una larga serie de pequeños triunfos y modestos avances.",triunfos
10415-10420 [Uso de las intenciones de implementación como señales para aumentar la tasa de vacunación contra la influenza].,vacunación
"Ir al baño te lleva a lavarte y secarte las manos, lo que te recuerda que debes poner las toallas sucias en la lavadora, lo cual hace que pongas jabón de lavandería en la lista de compras y así sucesivamente.",lavarte
Perder algo una vez es un accidente.8 Perderlo dos veces es el principio de un nuevo hábito.,Perder
v= a7Wh3uq1yTc [Retorcer los sabores y crear deseos].,Retorcer
13	Algunas investigaciones indican que el tamaño del cerebro humano alcanzó las proporciones modernas hace alrededor de 300 000 años.,proporciones
El sistema dictatorial tiene una serie diferente de creencias como la autoridad absoluta y la obediencia estricta.,obediencia
"Por esta razón, encuentras las marcas más caras en lugares que son más fáciles de alcanzar en los anaqueles de las tiendas y que, por lo tanto, dejan las mejores ganancias.",marcas
"Antes de que podamos construir nuevos hábitos de manera efectiva, necesitamos tener nuestros hábitos actuales bajo control.",actuales
"Las papas fritas, por ejemplo, son una potente combinación —crujientes, con un magnífico color dorado en el exterior y ligeras y suaves en el interior.5",potente
•	Cocina: Puedes solicitar que un servicio de entregas haga las compras de alimentos por ti.,Cocina
Te puedes imaginar fácilmente cómo alguien con más oxitocina puede estar inclinado a construir hábitos como escribir notas de agradecimiento y organizar fiestas y eventos sociales.,fiestas
¿Cómo diseñamos nuestros hábitos para que nos impulsen en lugar de desvanecerse?,diseñamos
Los investigadores también les explicaron la manera en que el ejercicio contribuía a reducir el riesgo de enfermedad coronaria y a mejorar la salud cardíaca.,explicaron
"La controversia que rodeó a la escultura se dio después, cuando un experto se dio cuenta, a simple vista, de que era una falsificación [Gladwell, Malcolm, Blink.",controversia
"Entre más sagrada sea una idea para nosotros —esto es, entre más profundamente esté vinculada a nuestra identidad—, más fuertemente la defenderemos de la crítica.",sagrada
"Ocho meses después, llegaron a ser los campeones de la NBA.",campeones
Haz que los costos de tus malos hábitos sean públicos y dolorosos.,públicos
En Nueva York se vendieron 45 000 boletos para sus tres espectáculos.,vendieron
"En el transcurso de unos meses, los investigadores vieron una rápida mejoría en la salud de los niños del vecindario.",mejoría
"En la década de los cuarenta, un científico holandés llamado Niko Tinbergen condujo una serie de experimentos que transformaron nuestra manera de entender aquello que nos motiva.1 Tinbergen —quien eventualmente ganó un premio Nobel por su trabajo— estaba investigando a las gaviotas arenque, las aves marinas de color gris con blanco que suelen verse a lo largo de las costas de América del Norte.",cuarenta
"1	K. Anders Ericsson y Robert Pool, Peak: Secrets from the New Science of Expertise, Boston, Mariner Books, 2017, p. 13 [Número 1: Secretos",Anders
Se trata de una inversión de la Segunda Ley del Cambio de Conducta: hazlo poco atractivo.,hazlo
"Tu sistema es la manera en que reclutas a los jugadores, diriges a tus entrenadores asistentes y conduces los entrenamientos.",reclutas
"Nos decimos a nosotros mismos: «Voy a comer de manera más saludable» o «Voy a escribir con mayor frecuencia», pero nunca nos decimos cuándo y dónde van a suceder estos hábitos.",decimos
"Por ejemplo, cuando la American Broadcasting Company [Compañía Americana de Televisión], mejor conocida como ABC, lanzó su horario de programación para los jueves en la noche de la temporada 2014-2015, promovió la estrategia de acumulación de tentaciones a escala masiva.",Broadcasting
1	Quizá te estés preguntando qué pasa con la suerte.,pasa
Por ejemplo: «Escribir una lista de toda la comida que consume cada día y pesarse diariamente».,pesarse
Imagina el impacto acumulativo que se lograría al hacer docenas de cambios de este tipo y vivir en un ambiente diseñado para simplificar las conductas buenas y dificultar las conductas perjudiciales.,lograría
"Cuando me sirva una comida, siempre voy a poner vegetales en mi plato antes que otra cosa.",vegetales
4	Bobby P. Smyth et al.,Smyth
La ambigüedad desapareció.,ambigüedad
PARA QUE DISFRUTE DE LOS HÁBITOS DIFÍCILES,DISFRUTE
GRANDIOSO,GRANDIOSO
"Y esa es la mayor razón por la cual nos ponemos en marcha pero no actuamos, porque queremos retardar el fracaso.",retardar
"Durante ese tiempo desarrolla un complejo sistema de raíces que, una vez maduro, le permite crecer más de 2 m en menos de seis semanas.",maduro
Mi Reporte de integridad anual responde tres preguntas:,responde
"En el Capítulo 6 dijimos que el diseño del ambiente es un método para hacer las señales más evidentes, pero también puedes optimizar el ambiente para poder realizar las acciones de manera más sencilla.",dijimos
Preparar más cápsulas era un proceso que consumía mucho tiempo porque tenía que hacerlo presionándolas manualmente con una máquina.,Preparar
"6	Cathal Dennehy, «The simple life of one of the world’s best marathoners», Runner’s World, 19 de abril 2016, https://www.runnersworld.com/elite-runners/the-simple-lifeofoneofthe- worlds-best-marathoners [La vida simple de uno de los mejores maratonistas del mundo].",Cathal
"Si pospones el ver televisión y terminas la tarea, generalmente aprendes más y obtienes mejores calificaciones.",pospones
Tendemos a confundir éxito con supervivencia.,confundir
CÓMO Y POR QUÉ ESCRIBÍ ESTE LIBRO,ESCRIBÍ
"Pero como las ganancias son exponenciales, la mejora es en realidad 10x mejor».",exponenciales
Incluso las bacterias tienen receptores químicos —pequeñas células sensoriales que les permiten detectar químicos tóxicos en su ambiente.,tóxicos
"Cámbiate a una habitación más grande, a un patio en el techo de la casa, o múdate a un edificio con arquitectura expansiva.",múdate
No tomó mucho tiempo para que la ecuación de Lewin fuera probada en el ámbito de los negocios.,probada
Debes despertarte temprano.,despertarte
El consciente y el inconsciente están trabajando en perfecta sincronía.,sincronía
"De hecho hay muchas maneras de medir el progreso, y en ocasiones ayuda cambiar el enfoque y dirigirlo hacia algo completamente distinto.",dirigirlo
Yo meditaré durante un minuto a las 7 a.m.,meditaré
"Para más información, véase Gretchen Rubin, México, Editores Mexicanos Unidos, 2016.",Mexicanos
"Ante la menor seña de aburrimiento, te puedes extraviar en el vasto espacio de las redes sociales.",seña
Esta es una de las razones por las que continuamente tratamos de asirnos al más reciente esquema para volvernos millonarios en instantes o para bajar de peso en poco tiempo.,asirnos
"Cientos de estudios han demostrado que las intenciones de implementación son efectivas2 para apegarnos a nuestras metas, ya sea que pongas por escrito la hora y la fecha exactas en que te vas a aplicar la vacuna contra la influenza3 o que registres la fecha de tu próxima cita para realizarte una colonoscopía.4 Las intenciones de implementación aumentan las probabilidades de que las personas se apeguen a hábitos como reciclar, estudiar, dormirse temprano y dejar de fumar.",Cientos
"Los adictos a la cocaína obtienen una dosis de dopamina cuando ven la sustancia, no después de que la ingieren.",ingieren
"Los receptores de nuestro cuerpo recogen una gran variedad de estímulos internos, por ejemplo la cantidad de sal en nuestra sangre o la necesidad de beber cuando tenemos sed.",recogen
Elimina tan solo una señal y el hábito completo se desvanece.,desvanece
": Tecnología adictiva, eliminando malos hábitos y aplicaciones para resolver la vida diaria].",adictiva
"Y cuando en mi negocio añades una buena historia de fondo, de pronto me encontré con un tema que pocos caricaturistas podrían aspirar a entender sin haberlo vivido.",caricaturistas
"Después de varios años de trabajar con personas que padecían de fallas cardíacas, la mujer había desarrollado, sin saberlo, la habilidad de reconocer este patrón a simple vista.",saberlo
A partir de esta idea es posible describir las leyes del movimiento y la relatividad.,relatividad
PEQUEÑAS LECCIONES DE LAS CUATRO LEYES,PEQUEÑAS
Riley comparaba el CBE de cada jugador en ese momento no solo con los resultados de su desempeño anterior sino con los de otros jugadores de la liga.,liga
Es el equivalente humano de las fuerzas geológicas.,geológicas
"Si una acción particular requiere un mayor esfuerzo físico o mental del que estás dispuesto a invertir, entonces no la realizarás.",realizarás
Las leyes y los reglamentos son un ejemplo de cómo los gobiernos pueden cambiar nuestros hábitos al crear un nuevo contrato social.,reglamentos
"Todas las personas, equipos y compañías que hemos cubierto en este libro han enfrentado diversas circunstancias, pero finalmente todos han progresado de la misma manera: mediante un compromiso con pequeñas, sustentables e implacables mejoras.",sustentables
"En muchos casos, cuando la gente elige el hábito incorrecto, simplemente significa que eligió un hábito muy difícil.",eligió
Empiezas a sentirte estresado por el exceso de trabajo.,Empiezas
Megan me dio el espacio que necesitaba para crear un libro del que me pudiera sentir orgulloso y apoyó mis ideas a cada paso.,apoyó
"2	Peter J. Richerson, Robert Boyd, Not by Genes Alone: How Culture Transformed Human Evolution, Chicago, University of Chicago Press, 2006 [No solamente por los genes: Cómo la cultura transformó la evolución humana].",Richerson
El modelo de Skinner hizo una excelente labor explicando cómo los estímulos externos influyen en nuestros hábitos.,explicando
"Sin embargo, aislaré el circuito de la dopamina en este capítulo porque nos brinda una ventana hacia las bases biológicas del deseo, el anhelo y la motivación que hay detrás de cada hábito.",aislaré
Mentalmente te encajonas dentro una estrecha concepción de la felicidad.,encajonas
Es muy complicado mantener una actitud zen en una vida llena de distracciones.,zen
Hay radiólogos experimentados que al ver una ecografía cerebral pueden predecir en qué área del cerebro se producirá un derrame aun antes de que haya algún síntoma evidente o signos visibles para el ojo que no está entrenado.4 Incluso he escuchado anécdotas acerca de estilistas que son capaces de notar si una clienta está embarazada con tan solo sentir los cambios en la textura del cabello.,radiólogos
"A modeling perspective», Biological Cybernetics 103, núm. 3, 2010, doi:10.1007/s00422-010-0401-y [¿Qué es lo que hacen los ganglios basales?",modeling
El consumo se disparó por los cielos y Wrigley se convirtió en la mayor compañía fabricante de goma de mascar en el mundo.9,disparó
"Como sociedad, acordamos de manera colectiva acatar las reglas y hacerlas obligatorias como grupo.",acatar
"Los otros participantes eran actores plantados en la habitación por el investigador, quien les proporcionaba un guion que indicaba las respuestas que debían dar a ciertas preguntas.",plantados
Reunió toda su ropa y le pidió a un asistente que la guardara dentro de un gran baúl.,Reunió
—Regresamos a algunas de las casas en Karachi seis años después —me contó Luby—.,Regresamos
"Para más información véase Colin G. Deyoung, «Personality neuroscience and the biology of traits», Social and Personality Psychology Compass 4, núm. 12, 2010, doi:10.1111/j.1751-004.2010.00327.x [Neurociencia de la personalidad y la biología de los rasgos].",Colin
—¿Cómo se llama tu mamá?,mamá
"Al principio, iba al gimnasio diariamente, pero se decía a sí mismo que solo tenía permitido hacer cinco minutos de ejercicio.",permitido
"Hablando de manera general, los hábitos buenos tendrán resultados positivos netos.",Hablando
Estas percepciones revelan la importancia de la Segunda Ley del Cambio de Conducta.,percepciones
El sentimiento de éxito es una señal de que tu hábito rindió frutos y de que valió la pena el esfuerzo.,rindió
"Los hábitos positivos pueden tener sentido a nivel racional, pero si entran en conflicto con tu identidad, vas a fracasar cuando intentes ponerlos en práctica.",ponerlos
", «Associations between exposure to takeaway food outlets, takeaway food consumption, and body weight in Cambridgeshire, UK: Population based, cross sectional study», British Medical Journal 348, núm. 5, 2014, doi:10.1136/bmj.g1464 [Relación entre exposición a puntos de venta de comida para llevar, consumo de comida para llevar y peso corporal en Cambridgeshire, Reino Unido: Estudio interseccional basado en la población].",Associations
El lado oscuro de llevar un registro o un historial de una conducta particular es que nos dejamos llevar por el número en lugar de guiarnos por el propósito detrás del hábito.,guiarnos
"Con el tiempo, las señales que desencadenan nuestros hábitos se vuelven tan comunes que son esencialmente invisibles: las golosinas en el aparador de la cocina, el control del televisor junto al sillón, el teléfono en el bolsillo.",golosinas
", «Stress-induced negative mood moderates the relation between Oxytocin administration and trust: Evidence for the tend-and-befriend response to stress?",negative
"Cuando tenga intención de comprar algo que cueste más de 2 000 pesos, esperaré y lo pensaré durante 24 horas antes de realizar la compra.",esperaré
"2	Pat Riley, Byron Laursen, «Temporary insanity and other management techniques: The Los Angeles Lakers’ coach tells all», Los Angeles Times Magazine, 19 de abril 1987, http://articles.latimes.com/1987–04–9/ magazine/tm1669_1_lakers [Locura temporal y otras técnicas de gestión: Los Lakers de los Ángeles].",Laursen
Te muerdes las uñas.,muerdes
"Muchos corredores entrenan durante meses, pero tan pronto como cruzan la línea de meta, dejan de entrenar.",cruzan
Empecé por publicar un artículo nuevo cada lunes y jueves.,Empecé
"Durante muchos años mantuvo el récord mundial en las carreras de 800, 1 500 y 2 000 metros.",récord
"Si poner tu teléfono en otra habitación no es suficiente, pídele a un amigo o a alguien de tu familia que lo esconda durante unas cuantas horas.",esconda
La gente queda tan atrapada en el hecho de que tiene límites que raramente hace el esfuerzo que se requiere para siquiera acercarse a ellos.,límites
Apaga las notificaciones y pon los chats grupales en modo de silencio.,Apaga
"Dicho eso, hay que reconocer que se requiere un tiempo para que la evidencia se acumule y una nueva identidad surja.",acumule
Las serpientes pueden oler mediante un sistema para «probar» el aire con sus sensibles lenguas.,lenguas
"Uno siempre espera realizar progresos de manera lineal y ascendente, por ello es frustrante cuando por períodos de días, semanas e incluso meses los cambios parecen no funcionar y uno tiene la sensación de permanecer en el mismo sitio.",progresos
"En pocos minutos, los ratones desarrollaron un anhelo tan fuerte que empezaron a meter la nariz dentro de la caja ochocientas veces por hora.12 (Los humanos no somos muy diferentes: el jugador promedio de máquinas tragamonedas da vuelta a la manivela seiscientas veces por hora).13",ochocientas
Tu cerebro comienza enseguida a analizar y catalogar los eventos que precedieron la recompensa.,analizar
[Enganchado.,Enganchado
¿Una persona sana ordenaría un burrito o una ensalada?,ordenaría
"Greg McKeown, consultor en liderazgo del Reino Unido, logró el hábito de escribir diariamente en un diario mediante el sistema de escribir siempre menos de lo que él tenía ganas de escribir.",Greg
Durante muchos años esa fue también la manera como abordé mis hábitos.,abordé
"Si estudias biología durante una hora cada noche, tienes evidencia de que eres estudioso.",estudias
"Después de quitarme los zapatos de trabajo, inmediatamente me pondré los tenis para hacer ejercicio.",quitarme
"Si te rodeas de personas que tienen buena condición física, será más probable que hacer ejercicio se convierta en un hábito común para ti.",rodeas
