sentence,words
"Las señales que pueden desencadenar un hábito se presentan de diversas maneras —la sensación de tu teléfono vibrando en tu bolsillo, el olor de las galletas con chispas de chocolate, el sonido de la sirena de una ambulancia—, pero las señales más comunes son el tiempo y el lugar.",chispas
"4	Siddartha Mukherjee, «The algorithm will see you now», New Yorker, 3 de abril 2017, https://www.newyorker.com/magazine/2017/04/03/ai-versus-md [El algoritmo te verá ahora].",Siddartha
"oby.20891 [La percepción de la discriminación por sobrepeso y los cambios en el peso, la medida de la cintura y el estado de peso].",discriminación
"Al principio de la gráfica (A), se requiere una gran cantidad de esfuerzo y concentración para realizar un hábito.",gráfica
"La ropa de vestir es toda aquella ropa aparte de los jeans, playeras, camisetas, sudaderas y shorts.",jeans
Esta es una de las razones por las que las técnicas para cambiar la conducta fracasan.,fracasan
15	Los rápidos cambios en el ambiente de los siglos recientes han sobrepasado nuestra capacidad biológica para adaptarnos.,sobrepasado
"La punta del avión apenas si se movería un par de metros, pero si la distancia se magnificara durante el vuelo, el avión terminaría en un lugar que está a cientos de kilómetros del destino original.",magnificara
Ello a pesar de nuestro más sincero esfuerzo y de los ocasionales estallidos de motivación.,ocasionales
"Lo anterior nos conduce a una pregunta importante: ¿si tus creencias y tu visión del mundo desempeñan un papel tan importante en tu conducta, de dónde surgen en primer lugar?",desempeñan
Decoró su casa con caras esculturas.,Decoró
"Cuando tu cambio de hábitos implica armonizar con el resto del grupo, entonces el cambio se vuelve muy atractivo.",armonizar
"Entre menos resistencia tengas que enfrentar, más sencillo será que la parte más fuerte de tu ser emerja.",emerja
"Finalmente, además de mi propio trabajo, cada año publico una lista de mis libros favoritos de otros autores, pertenecientes a un amplio rango de materias.",publico
La segunda opción consiste simplemente en estirar la manguera para que el agua fluya sin resistencia.,fluya
"Cuando sentimos anhelos, estamos insatisfechos pero determinados.",insatisfechos
La mayoría de la gente en el público estaba demasiado ocupada bebiendo o charlando para ponerle atención.,bebiendo
Vuélvela a conectar solamente cuando seas capaz de decir el nombre del programa que quieres ver.,Vuélvela
"La respuesta la aprendí de Scott Adams, el caricaturista creador de la tira cómica Dilbert.",creador
"Los científicos han descubierto que mostrar a los adictos una imagen de la cocaína durante solamente 33 microsegundos estimula el deseo de alcanzar la recompensa en el cerebro.11 Esta velocidad es demasiado rápida para que el cerebro pueda registrarla conscientemente —los adictos no logran siquiera decir lo que acaban de ver—, sin embargo desean la droga de todas maneras.",microsegundos
* Puedes ver mis Reportes de integridad anteriores en jamesclear.com/annual-review,Reportes
Lo mismo se aplica a los anaqueles que se encuentran al principio o al final de los pasillos del supermercado.,supermercado
"Cuando entrenas todos los días, encarnas la identidad de una persona atlética.",entrenas
"Si quieres ver deportes, pero necesitas hacer llamadas de ventas:",llamadas
La clave para encontrar y reparar las causas de tus malos hábitos consiste en replantearse las asociaciones que has desarrollado a partir de ellos.,reparar
Nuestro primer error consiste en tratar de cambiar algo que no es lo que debemos cambiar.,error
", «Navigation-related structural change in the Hippocampi of taxi drivers», Proceedings of the National Academy of Sciences 97, núm. 8, 2000, doi:10.1073/pnas.070039597 [El cambio estructural relacionado con la navegación en el hipocampo de conductores de taxi]; Katherine Woollett y Eleanor A. Maguire, «Acquiring “the knowledge” of London’s layout drives structural brain changes», Current Biology 21, núm. 24, diciembre 2011, doi:10.1016/ j.cub.2011.11.018 [Adquirir el conocimiento del trazado de la ciudad de Londres provoca cambios estructurales en el cerebro]; Eleanor A. Maguire, Katherine Woollett, Hugo J. Spiers",Hippocampi
17 Cómo un socio corresponsable puede cambiarlo,cambiarlo
"En una conversación que tuve con Orland por correo electrónico (18 de octubre 2016), él me explicó los orígenes de la historia: «Sí, la “historia de la cerámica” que aparece en Art & Fear es verdad, aparte de ciertas licencias literarias que nos permitimos cuando la redactamos para el libro.",licencias
"Y si usara el hilo dental todas las noches, pero solo me quedara la boca limpia la mitad de las veces, creo que dejaría de usarlo.",quedara
Correr 5 km es difícil.,km
"la neumonía, 48%, y el impétigo, una infección bacterial de la piel, un 35 por ciento.5",neumonía
"Si estás rodeado de amantes del jazz, existen más posibilidades de que te parezca razonable tocar  jazz todos los días.",jazz
Necesitas la proporción justa de «ganancia» para experimentar satisfacción y la cantidad justa de «ganas de tener algo» para experimentar deseo.,justa
"Ya sea que te estés aproximando a los cambios de conducta como un individuo, un padre de familia, un entrenador o un líder, debemos hacernos la siguiente pregunta: «¿Cómo puedo diseñar un mundo en el que sea fácil hacer lo que es correcto?».",aproximando
"En aquella época, Fisher estaba concentrado en diseñar estrategias que pudieran prevenir una guerra nuclear, y había notado un hecho preocupante.",concentrado
Llamo a esto Tomar Sus Números.,Llamo
Tomar café queda asociado con despertar.,Tomar
"Si me preguntaras por qué quiero comer tacos, no te respondería: «Porque necesito comida para sobrevivir».1 Pero la verdad es que, en algún lugar profundo de mi ser, estoy motivado a comer tacos porque necesito comida para sobrevivir.",preguntaras
Ignora lo que otros esperan de ti.,esperan
El hospital donde estábamos no le resultaba extraño a mis padres.,padres
18 La verdad acerca del talento (Cuándo los genes importan y cuándo no),genes
"Quizá quieres hacerte una pedicura, pero también tienes que revisar tu bandeja de correos electrónicos.",pedicura
Tenían una clara preferencia por aquellas manchas rojas —como si estuvieran genéticamente programadas desde su nacimiento—.,programadas
"Los anuncios publicitarios se crean con una combinación ideal de luz, maquillaje profesional y ediciones con Photoshop —incluso los propios modelos no se reconocen en la persona que aparece en la imagen final—.",Photoshop
"Pero los alimentos que tienen un alto contraste dinámico mantienen la experiencia renovada e interesante, por lo que te sientes impulsado a comer más.",renovada
"Cuando el deseo es alto, duele mucho cuando no te gusta el resultado.",duele
No se necesita un sistema para mejorar constantemente la manera en que te cepillas los dientes o te amarras las agujetas o te preparas una taza de té por la mañana.,amarras
"La gente que tiene un estatus alto disfruta de la aprobación, el respeto y el reconocimiento de los demás.",disfruta
Tus opciones están limitadas por lo que hay disponible.,limitadas
"Tuve que confiar en pequeños hábitos para lograr mi recuperación después de mi accidente, para volverme más fuerte en el gimnasio, para lograr un desempeño de alto nivel en el campo de juego, para convertirme en escritor, para construir un negocio exitoso, y, sobre todo, para convertirme en un adulto responsable.",adulto
"Si Uber me proporcionara el servicio de taxi la mitad de las veces en que lo solicito, dudo que seguiría usando la aplicación durante mucho tiempo.",Uber
"Si la conducta es demasiado difícil, no serás capaz de realizarla.",realizarla
Usualmente se les llama centros hedónicos y están distribuidos como pequeñas islas en todo el cerebro.,hedónicos
"En tercer lugar, quiero agradecer a mi asistente, Lindsey Nuckols.",Lindsey
La comida chatarra es una forma más concentrada de calorías que la comida natural.,concentrada
Cosas como criar a un hijo o iniciar un negocio o escalar el Monte Everest.,Everest
"Descrito por primera vez por Donald Hebb en 1949, este fenómeno se conoce comúnmente como la Ley de Hebb: «Las neuronas que se encienden juntas, se mantienen conectadas».4",Descrito
Compró un espejo para colocarlo sobre la chimenea y una mejor mesa para la cocina.,chimenea
"11	Allan Richarz, «Why Japan’s Rail Workers Can’t Stop Pointing at Things», Atlas Obscura, 29 de marzo 2017, https://www.atlasobscura.com/articles/pointing-and-calling-japan-trains",Allan
Tuvo que esforzarse para contener las lágrimas cuando le explicó a mi hermana que no podría asistir a su graduación de bachillerato que sería esa misma noche.,graduación
"—Cuando los jugadores se unen a los Lakers por primera vez —explicaba Riley—, averiguamos sus estadísticas de basquetbol hasta el momento en que estaban en la escuela preparatoria.",averiguamos
La habitación está fría y tú puedes ver tu propio aliento.,fría
4	Todas las citas de esta sección fueron tomadas de una conversación por correo electrónico con Stephen Luby el 28 de mayo 2018.,tomadas
"9	James Olds y Peter Milner, «Positive reinforcement produced by electrical stimulation of septal area and other regions of rat brain», Journal of Comparative and Physiological Psychology 47, núm. 6 (1954), doi:10.1037/h0058775 [Reforzamiento positivo producido por estímulos eléctricos en el área septal y otras regiones del cerebro de una rata].",Positive
"Empezamos este capítulo discutiendo los estímulos supernormales, los cuales son versiones aumentadas de la realidad que incrementan nuestro deseo de realizar acciones.",Empezamos
En otras ocasiones el problema es que estás experimentando dolor y quieres eliminarlo.,eliminarlo
"Si estás desperdiciando el tiempo en línea, toma nota de que estás destinando tiempo de tu vida de una manera que no te gusta.",destinando
Mucho de la batalla por generar buenos hábitos se reduce a encontrar maneras de reducir la tensión asociada con nuestros buenos hábitos e incrementar la tensión asociada con nuestros hábitos malos.,generar
"Todavía tenía el aspecto de alguien que hubiera estado en el lado equivocado de un cuadrilátero de boxeo, pero de cualquier manera me dieron autorización para salir del hospital.",cuadrilátero
Este es un punto importante del que hablaremos en detalle más adelante.,hablaremos
Adaptación de portada: Karla Anaís Miravete,Karla
La especialización es una poderosa manera de superar el «accidente» de una mala genética.,especialización
Llena el Registro de hábitos.,Llena
"Si no compras postres y frituras en la tienda, generalmente comerás algo más saludable cuando llegues a casa.",postres
El corredor keniano Eliud Kipchoge es uno de los más grandes maratonistas de todos los tiempos y medallista olímpico.6 Hasta la fecha él todavía toma notas después de cada entrenamiento para llevar un registro que le permita revisar sus resultados diarios y buscar áreas en las que puede realizar mejoras.,keniano
Catorce medallas de oro estaban disponibles en las pruebas de ruta y pista.,Catorce
•	«Soy malísimo para recordar los nombres de las personas».,malísimo
Te despiertas.,despiertas
*  Diseñé un diario de hábitos específicamente para hacer que escribir un diario sea algo sencillo.,Diseñé
Es más difícil que pospongas el trabajo o que te rindas porque hay un costo inmediato.,pospongas
"Thomas Frank, un empresario de Boulder, Colorado, se despierta a las 5:55 cada mañana.",despierta
La formación de hábitos es increíblemente útil porque la mente consciente es el cuello de botella del cerebro.8 El cerebro solamente puede poner atención a un problema a la vez.,botella
"Las cosas que tienes que hacer solamente una vez al mes o al año —como revisar y balancear tu portafolio de  inversión—, no se repiten con suficiente frecuencia como para convertirse en hábitos, por lo tanto resulta bastante beneficioso hacer que la tecnología te «recuerde» lo que tienes que hacer.",balancear
"«Elevate your financial IQ: A value packed discussion with Jason Zweig», entrevista de Shane Parrish, The Knowledge Project, Farnam Street, audio, https://www.fs.blog/2015/10/jason-zweig-knowledge-project [Eleva tu IQ financiero.",Elevate
•	Apagar la alarma,alarma
13	Mitsuhiro Matsuzaki et al.,Mitsuhiro
I don’t even have to play any music»,even
"La matemática de las pequeñas mejoras funciona de la siguiente manera: si logras ser 1% mejor cada día durante un año, terminarás siendo 37 veces mejor al final del período.12 Por el contrario, si deterioras tu conducta 1% cada día, al final de un año habrás llegado casi a cero.",deterioras
"20 	Scott Adams, «Career advice», Dilbert Blog, 20 de julio, 2007, http:// dilbertblog.typepad.com/the_dilbert_ blog/2007/07/career-advice.html [Orientación vocacional].",Career
Esta es una idea que cubrimos a detalle cuando hablamos de la Tercera Ley del Cambio de Conducta.,cubrimos
Hay una versión de cada hábito que puede proporcionarte alegría y satisfacción.,proporcionarte
", «A 2phase labeling and choice architecture intervention to improve healthy food and beverage choices»",labeling
En una elección hay votos tanto para demócratas como para republicanos.,demócratas
", «Using implementation intentions prompts to enhance influenza vaccination Rates», Proceedings of the National Academy of Sciences 108, núm. 26, junio 2011, pp.",Using
Hay que poner ese número de código [nuclear] dentro de una pequeña cápsula y luego implantarla a un lado del corazón de un voluntario.,cápsula
"Por ejemplo, los artículos que están colocados al nivel de los ojos tienden a comprarse más que aquellos que están colocados cerca del suelo.",suelo
"Para más información véase C.G. Jung, Aion: Researches into the Phenomenology of the Self , Princeton, Nueva Jersey, Princeton University Press, 1959, p. 71 [Aion: Contribuciones al simbolismo del sí-mismo, Barcelona, Paidós, 2010].",Researches
"Como resultado, la agricultura se expandió casi dos veces más rápido de Europa a Asia que en cualquier otro lugar.",expandió
"Con frecuencia las personas eligen productos no por lo que son sino por el lugar donde se encuentran.2 Si entro a la cocina y veo un plato de galletas en la mesada, seguramente tomaré una docena y empezaré a comérmelas, incluso si no había pensado en ellas anteriormente y a pesar de que no tenga hambre.",eligen
Tomas una taza de café.,café
No estás preocupándote por ponerte en forma.,preocupándote
"•	Después de poner mi plato en el lavavajillas, voy a escribir lo que comí.",comí
Otras simplemente se olvidaban de lavarse antes de preparar los alimentos.,olvidaban
Recuerdo con nitidez el día en que me comunicaron la noticia.,nitidez
"Tan solo cinco años después de que Brailsford tomara el mando, el equipo de ciclismo británico dominó las diversas pruebas en los Juegos Olímpicos de Pekín 2008, donde obtuvieron un sorprendente 60% de las medallas disponibles para esta actividad.7 Cuatro años después, en los Juegos Olímpicos de Londres, los británicos elevaron el nivel de la prueba al romper nueve récords olímpicos y siete récords mundiales.8",mando
"Mientras daba los últimos toques a este libro durante 2018, jamesclear.com estaba recibiendo millones de visitantes al mes y casi 500 000 personas se estaban suscribiendo al correo electrónico de mi boletín informativo cada semana.",toques
Los científicos se refieren a esto como la diferencia entre desear y gustar.,gustar
* Charles Duhigg y Nir Eyal merecen un reconocimiento especial por su influencia en la creación de esta imagen.,Nir
"•	La meta no es correr un maratón, la meta es convertirse en corredor.",correr
Hacer lo correcto es sencillo.,correcto
"Pero en la medida que el número de actores se incrementaba desde tres o cuatro hasta ocho, el sujeto se volvía más proclive a cuestionar su juicio y estar de acuerdo con la mayoría.",incrementaba
"Al final, decidí publicar una versión adaptada, que combina la historia de la cerámica que contaron Bayles y Orland en su libro con hechos relatados por la fuente original, los estudiantes de fotografía de Uelsmann.",combina
"Entre más altos son los corredores, son más pesados, y cada kilo de más es una maldición cuando se trata de carreras de pista.",kilo
Los tiburones pueden detectar pequeñas cargas eléctricas y vibraciones en el agua producidas por peces cercanos.,tiburones
"Toma un descanso del espacio donde sueles trabajar, el cual también está encadenado a tus actuales patrones de pensamiento.",encadenado
Proveen un recordatorio anual para revisitar mi identidad deseada y para considerar cómo mis hábitos me están ayudando a convertirme en la persona que deseo ser.,ayudando
"Quizá te estés preguntando ¿si mantener un historial de hábitos es tan útil, por qué nos tardamos tanto en empezar a hablar de este tema?",tardamos
"Mientras el comportamiento humano esté involucrado, este libro puede servirte de guía.",servirte
Repetir.,Repetir
"En palabras del inversionista Paul Graham: «mantén pequeña tu identidad».10 Entre más permitas que una sola creencia te defina, menos serás capaz de adaptarte cuando la vida te presente desafíos.",defina
"Los hábitos son el interés compuesto de la superación personal.13 De la misma manera en que el dinero se multiplica mediante el interés compuesto, los efectos de tus hábitos se multiplican en la medida en que los repites cada día.",multiplica
"Cuando borro las aplicaciones de redes sociales de mi teléfono, pueden pasar semanas antes de que las vuelva a instalar y me conecte a ellas.",borro
"8 	«World and Olympic records set at the 2012 Summer Olympics», Wikipedia, 8 de diciembre 2017, https://en.wikipedia.org/wiki/World_and_Olympic_records_set_at_the_2012_Summer_Olympics#Cycling.",records
"Dejar de comer animales que no tengan patas (pescado, almejas, ostiones, etc.).",pescado
"Y como estamos a punto de ver, los hábitos que son normales dentro de tu cultura, son los más atractivos hábitos que podemos encontrar.",normales
La mentalidad que verdaderamente se enfoca en el largo plazo no se centra en el cumplimiento de metas.,cumplimiento
"Salgo a la calle fuera de mi casa en Manhattan, tomo un taxi y le pido que me lleve al gimnasio Pumping Iron que se encuentra en la esquina de la Calle 91 y la Avenida 1, donde hago ejercicio durante dos horas».",Salgo
•	Ganar aceptación social y aprobación.,Ganar
Vives en lo que los científicos llaman sistema de retorno inmediato porque tus acciones producen resultados claros e inmediatos.,Vives
"El cerebro está escaneando constantemente el ambiente, prediciendo lo que va a acontecer a continuación, experimentando con diferentes respuestas y aprendiendo de los resultados.",escaneando
Las hermanas Polgar —las prodigiosas jugadoras de ajedrez mencionadas al principio de este capítulo— son prueba de la poderosa y perdurable influencia que el impacto social puede tener en nuestro comportamiento.,prodigiosas
"De pronto, tú no solo te estás fallando a ti mismo por no cumplir tus promesas, también le estás fallando a otras personas.",fallando
Una de las gansas observadas hizo un enorme esfuerzo para rodar una pelota de voleibol hasta su nido y para sentarse después sobre ella.,observadas
"Entre más automático es un proceso cognitivo, más se desliza hacia el Sistema 1 del espectro.",desliza
"2	Voltaire, La Bégueule.",Bégueule
EXPERIMENTO DE CONFORMIDAD SOCIAL,EXPERIMENTO
* De pronto Diderot tuvo dinero para gastar en grande.,grande
"Cuando es necesario, selecciona una tarjeta apropiada y la envía al destinatario.",destinatario
"Y si la recompensa es incapaz de satisfacer tu deseo, entonces no habrá una razón para que la repitas en el futuro.",repitas
Dile a tu compañero de trabajo que lo mantenga guardado en su escritorio durante la mañana y  te lo devuelva a la hora del almuerzo.,mantenga
•	Te bañas.,bañas
* Los términos inconsciente y subconsciente pueden usarse indistintamente para indicar ausencia de conciencia o pensamiento.,subconsciente
"2	Gary A. Klein, Sources of Power..., ibidem, pp.",ibidem
"Desafortunadamente, el lento ritmo de la transformación también hace que sea muy fácil permitir el retorno de los malos hábitos.",lento
"Si necesita fotocopiar o escanear algún fragmento de esta obra diríjase al CeMPro (Centro Mexicano de Protección y Fomento de los Derechos de Autor, http://www.cempro.org.mx).",fotocopiar
Lo brillante de la solución de la caja registradora fue que automatizó la conducta ética al hacer el robo prácticamente imposible.,automatizó
", New England Journal of Medicine 357, núm. 4, 2007, doi:10.1056/nejmsa066082.",England
No te olvides de repetir esta acción la próxima vez».,olvides
"En su lugar, tal vez podrías hacer que tu recompensa fuera un masaje, lo cual es al mismo tiempo suntuoso y te ayuda a cuidar de tu cuerpo.",suntuoso
"Resulta obvio, pero un hábito solo puede ocurrir cuando eres capaz de realizarlo.",realizarlo
"habido incontables días en lo que tenido ganas de relajarme y descansar, pero nunca me he arrepentido de haber trabajado en algo que era importante para mí.",arrepentido
"Si bajaba la velocidad durante un tiempo, el programa que estaba viendo se ponía en pausa hasta que él volviera a pedalear nuevamente a la velocidad correcta.",bajaba
"◆	Los hábitos se pueden completar en unos cuantos segundos, pero siguen impactando nuestra conducta durante minutos e incluso horas después.",impactando
"En lugar de decirte: «Debo ir a correr en la mañana», puedes decir: «Es hora de desarrollar mi resistencia y volverme más veloz».6",decirte
"Considera, por ejemplo, de cuántas diferentes maneras un fumador puede ser tentado a sacar un cigarro: manejar en su auto, ver a un amigo fumar, sentirse estresado en el trabajo y así sucesivamente.",tentado
10		Estoy en deuda con S.J. Scott por el término acumulación de hábitos.,Scott
"Para más información véase Jonah Lehrer, How We Decide, Boston, Houghton Mifflin Harcourt, 2009 [Cómo decidimos.",Jonah
"Al contrario, puedes constituirte como arquitecto de tu propio ambiente.",constituirte
"Coloca tus lápices, plumas, cuadernos y otras herramientas de dibujo sobre tu escritorio, donde sean fácilmente accesibles.",lápices
Como el matemático y filósofo Alfred Whitehead escribió: «La civilización avanza al aumentar el número de operaciones que podemos realizar sin tener que pensar en ellas».6,operaciones
"Cuando regresé al campo de beisbol justo un año después, fue muy doloroso darme cuenta de lo mucho que me faltaba por conseguir.",regresé
"QUE NECESITO], yo haré [HÁBITO QUE QUIERO].",QUIERO
"8	Jennifer P. Mathews, Chicle: The Chewing Gum of the Americas, from the Ancient Maya to William Wrigley, Tucson, University of Arizona Press, 2009, pp.",Jennifer
"15	«Por ejemplo, toda la gente tiene sistemas cerebrales que responden a las recompensas, pero en diferentes individuos estos sistemas responderán con diferentes grados de vigor a una recompensa particular, y el nivel promedio de respuesta de los sistemas puede estar asociado con algún rasgo de la personalidad».",responderán
"En algún momento, todos experimentamos el mismo reto en el camino de la mejora personal: te tienes que enamorar del aburrimiento y seguir con tu hábito.",enamorar
"Progresar es satisfactorio y las medidas visuales —como mover clips, pasadores o canicas— proveen clara evidencia del progreso realizado.",Progresar
"Cuando suene mi teléfono, respiraré profundamente y sonreiré antes de contestar.",respiraré
"En las tardes, me era muy complicado dejar de trabajar.",tardes
"Cuando se elige de manera efectiva, una identidad puede ser flexible en lugar de debilitadora.",debilitadora
"A pesar de nuestras buenas intenciones, los hábitos poco saludables, como comer comida chatarra, ver demasiada televisión, aplazar las obligaciones y fumar, dan la impresión de ser imposibles de romper.",aplazar
"No quieres prender la televisión, lo que quieres es ver algo que te entretenga.",prender
"Las personas en la cumbre de cualquier campo competitivo no solo están bien entrenadas, también están bien equipadas para la tarea.",cumbre
"1	Matt Slater, «How GB cycling went from tragic to magic», BBC Sport, 14 de abril 2008, http://news.bbc.co.uk/sport2/hi/olympics/cycling/7534073.stm.",went
"Con la comida natural que no está procesada, tendemos a experimentar las mismas sensaciones una y otra vez —«¿a qué sabe el 17° bocado de kale?».",procesada
"Me sentí como un impostor cuando comencé a escribir dos años antes, pero al parecer, ahora me había convertido en un especialista en hábitos, una etiqueta que me emocionaba y al mismo tiempo me hacía sentir incómodo.",impostor
A veces tenemos la impresión de que es demasiado complicado mantener un buen hábito por más de unos días.,complicado
Sueño,Sueño
"Sin embargo, es más productivo enfocarse en saber si estás alcanzando tu máximo potencial en lugar de compararte con alguien más.",compararte
"13	Denis Diderot, «Regrets for my old dressing gown», traducido por Mitchell Abidor, 2005, https://www.marxists.org/reference/archive/diderot/1769/regrets.htm [Pesar por mi vieja bata].",Regrets
"Simultáneamente hace que una conducta sea obvia, atractiva y satisfactoria.",Simultáneamente
"Cuando te enamoras del proceso más que del producto final, no tienes que esperar hasta el desenlace para permitirte ser feliz.",enamoras
