sentence,words
En las sesiones de terapia física tuve que practicar patrones motores básicos como caminar en línea recta.,sesiones
"El último día de clases, él haría el recuento del total de fotos entregadas por cada alumno.",entregadas
Compró los derechos del invento de Ritty y abrió la National Cash Register Company [Compañía Nacional de Cajas Registradoras].,Cash
"De hecho, algunas investigaciones han demostrado que una vez que se ha alcanzado la maestría de una habilidad, con el tiempo tiene lugar un ligero declive del desempeño.1",declive
"Cuando trabaja en tu contra, tu identidad crea un tipo de «orgullo» que te impulsa a negar tus puntos débiles y evita que crezcas verdaderamente.",débiles
"Todos tenemos que lidiar con contratiempos y retrocesos pero, a la larga, la calidad de nuestra vida depende de la calidad de nuestros hábitos.1 Si mantienes los mismos hábitos que tienes ahora, tendrás resultados equivalentes.",contratiempos
"Parecería un consejo extraño, pero con el tiempo, los investigadores se dieron cuenta de que al asociar la cama con dormir y no con otras actividades como leer, ver televisión, acostarse, etc., los participantes pronto eran capaces de dormirse rápidamente debido a un proceso repetido: se volvió casi automático el quedarse dormido en la cama ya que se había creado un exitoso disparador».",Parecería
20	La inspiración para este dibujo provino de un tuit titulado «Deception de linear vs.,provino
CÓMO RECUPERARTE RÁPIDAMENTE CUANDO TUS HÁBITOS SE INTERRUMPEN,RECUPERARTE
No se trata de usar hilo dental cada noche ni de tomar duchas frías cada mañana o de usar la misma ropa todos los días.,duchas
Nuestros genes no eliminan la necesidad de trabajar duro.,eliminan
"Si constantemente te encuentras luchando para cumplir con tus planes, entonces puedes tomar una página de Víctor Hugo y hacer tus malos hábitos más difíciles, creando lo que los psicólogos llaman un mecanismo de compromiso.",creando
"Después de que te topas con una recompensa inesperada, alteras tu estrategia para la siguiente ocasión.",alteras
¿Haría las lagartijas antes de comer el almuerzo? ¿Después de comerlo?,comerlo
Los alimentos y el agua nos proporcionan la energía que necesitamos para sobrevivir.,necesitamos
"En  la primera versión se leía: «El primer objetivo de Bryan para el primer trimestre de 2017 es comenzar a comer correctamente otra vez para poder sentirse mejor, verse mejor y alcanzar su meta a largo plazo de llegar a pesar 90 kilos y tener solamente 10% de grasa corporal».",correctamente
"Este accidente fue uno de mis retos y la experiencia me enseñó una lección fundamental: los hábitos que en un principio pueden parecer pequeños y poco significativos, se transformarán en resultados extraordinarios si tienes la voluntad de mantenerlos durante varios años.",transformarán
"Desde 1908, los ciclistas británicos habían conseguido solamente una medalla de oro en los Juegos Olímpicos1 y habían tenido aun peores resultados en la carrera ciclista más importante del mundo, el Tour de France.2 En 110 años ningún ciclista británico había ganado esa carrera.",Tour
"Una vez que asocias una solución con el problema que necesitas resolver, empiezas a utilizarla repetidamente.",asocias
"2	Michael Goryl, Michael Cynecki, «Restraint system usage in the traffic population», Journal of Safety Research 17, núm. 2, 1986, doi:10.1016/0022–375(86)90107-6 [Uso de un sistema restrictivo en la población de automovilistas].",Goryl
"A pesar de que ya estaba trabajando con adultos, sus antiguos hábitos seguían apareciendo y, sin darse cuenta, les preguntaba a sus colegas si se habían lavado las manos después de ir al baño.7 También di con la historia de un hombre que había pasado años trabajando como salvavidas y que de cuando en cuando, gritaba «¡Camina!» cuando veía a un niño corriendo.8",preguntaba
"2	Peter Gollwitzer, Paschal Sheeran, «Implementation intentions and goal achievement: A meta‐analysis of effects and processes», Advances in Experimental Social Psychology 38, 2006, pp.",Gollwitzer
"Con cada repetición, el envío de señales de una célula a otra mejora y las conexiones neuronales se fortalecen.",célula
Los pequeños hábitos que cultivé me ayudaron a desarrollar todo mi potencial.,cultivé
"El motivo subyacente es obtener comida y agua, aunque mi deseo superficial y específico sea comer un taco.",taco
"en punto cada noche (leer un libro en la cama, platicar con tu pareja).",platicar
Contar calorías puede parecer un fastidio cuando ya estás esforzándote en seguir una dieta.,Contar
Dónde y cuándo insertes un nuevo hábito en tu rutina diaria pueden marcar una gran diferencia.,insertes
"En lugar de seguir cometiendo los mismos errores, los gatos comenzaron a llegar directamente a la solución correcta.",cometiendo
Te estás convenciendo a ti mismo de la necesidad de realizar la acción y eso puede hacer la diferencia.,convenciendo
"Entre más automática se vuelve una conducta, hay menos probabilidades de que pienses en ella de manera consciente.",pienses
La hija de Diderot estaba a punto de casarse y él no tenía dinero para pagar la boda.,casarse
Cancela tu suscripción a correos electrónicos publicitarios.,Cancela
"En 1993, un banco en Abbotsford, Canadá, contrató a un corredor de bolsa llamado Trent Dyrsmid.",Abbotsford
"El resto del libro te proporcionará instrucciones paso a paso de cómo construir mejores hábitos para ti, para tu familia, para tu equipo, para tu compañía y cualquier otro ámbito que sea importante para ti.",resto
", «Sustained improvements in handwashing indicators more than 5 years after a cluster‐randomised, community‐based trial of handwashing Promotion in Karachi, Pakistan», Tropical Medicine & International Health 18, núm. 3, 2013, pp.",Sustained
"Para ser más preciso, tus hábitos son la manera como encarnas  tu identidad.",encarnas
"3	La historia de Getty Kouros, incluida en el libro de Malcolm Gladwell, Blink, es un famoso ejemplo.",Getty
"Un grupo se puso en marcha, mientras que otro grupo actuó.",actuó
Tratamos de seguir una dieta muy estricta el día que salimos a cenar con nuestros amigos.,salimos
4	Benjamin Harkin et al.,Harkin
"En un intento por pasar menos tiempo con este egomaníaco, ella actuaba de manera tan poco interesante y aburrida como era posible cuando él estaba cerca.",egomaníaco
"3	Un reconocimiento a mi amigo Nathan Barry, quien originalmente me inspiró con el mantra «Crea algo cada día».",Nathan
* Puedes ver los contratos de hábitos que utilizó Bryan Harris y bajar un formato en blanco en atomichabits.com,contratos
"Por sí solas estas causas de estrés son tolerables, pero si persisten por años, estas pequeñas preocupaciones se acumulan y se convierten en problemas de salud muy graves.",persisten
O: «Hice una lluvia de ideas para el libro que quiero escribir.,Hice
No pienses demasiado ni te detengas a criticarte.,criticarte
Por ello es mejor evitar tocarla.,tocarla
"Para mediados de los setenta, ya había logrado ser un invitado frecuente en programas como The Tonight Show y Saturday Night Live.",Tonight
En realidad se trataba del año 2002.,trataba
La segunda persona rechaza el cigarro diciendo: «No gracias.,rechaza
"*  Mientras este libro entraba a imprenta, se publicó nueva información sobre el equipo de ciclismo británico.",imprenta
"Como vemos, la forma más común de cambiar no es interna, sino externa: el mundo a nuestro alrededor nos cambia.",vemos
Pero ocasionalmente nuestra predisposición por la gratificación instantánea nos causa problemas.,predisposición
", «Insensitivity to future consequences following damage to human prefrontal cortex», Cognition 50, núms.",Insensitivity
"Si afirmas que algo es una prioridad, pero nunca actúas en consecuencia, entonces significa que no lo quieres realmente.",afirmas
•	La canción que estás escuchando termina.,escuchando
"14	J. Ormel, A. Bastiaansen, H. Riese et al.",Ormel
"Después de esa derrota, Riley se cansó de escuchar cuánto talento tenían sus jugadores y cuán prometedor era su equipo.",prometedor
T. Burgoine et al.,Burgoine
"En su libro, Kotler cita: «Chip Conley, AI, septiembre de 2013.",Chip
*	Las personas interesadas en Habits Academy pueden visitar habitsacademy.com,visitar
"De manera sorprendente, los Lakers tropezaron en el repechaje de la temporada 1986 y sufrieron una derrota que los dejó fuera del campeonato durante las finales de la Conferencia del Oeste.",tropezaron
"Cuando el comediante Chris Rock está preparando material nuevo, se presenta primero en docenas de clubes nocturnos pequeños y prueba cientos de chistes nuevos.8 Lleva una libreta al escenario y registra cuáles son los chistes o fragmentos que funcionan bien y en cuáles tiene que realizar ajustes.",clubes
De manera similar la medallista olímpica Katie Ledecky registra su bienestar con una escala de 0 a 10 e incluye notas sobre su nutrición y qué tan bien durmió.,olímpica
"Cuando comes comida chatarra o enciendes un cigarro o pierdes tiempo navegando en las redes sociales, lo que realmente quieres no es una papa frita o un cigarro o un montón de likes.",enciendes
"Los centros destinados a desear ocupan grandes áreas del cerebro: el tallo cerebral, el núcleo accumbens, el área ventral tegmental, el núcleo estriado dorsal, la amígdala y porciones de la corteza prefrontal.",ocupan
Uno de mis compañeros se quitó la playera y me la pasó.,quitó
"Cada jueves, la compañía transmitía de forma consecutiva tres series de televisión creadas por la guionista Shonda Rhimes —Anatomía de Grey [Grey’s Anatomy], Escándalo [Scandal] y Lecciones del crimen [How to Get Away with Murder].",transmitía
La versión adaptada se incluyó con el permiso otorgado en un intercambio de correos electrónicos con el autor en abril 2018 [¿Por qué algunas personas son adictas a los carbohidratos?].,incluyó
"Intenciones de implementación, participación de votantes y planificación orgánica].",orgánica
Avergonzar a las personas obesas con presentaciones de pérdida de peso puede provocarles tensión.,Avergonzar
"Para mayor información véase David Allen, Getting Things Done, Nueva York, Penguin, 2015 [Haz lo que tienes que hacer].",Getting
"Cuando eres niño, pensar en la mañana de Navidad puede ser mejor que abrir los regalos.",regalos
Salud en general,Salud
"Sin reflexionar, podemos inventar excusas, crear racionalizaciones y mentirnos a nosotros mismos.",racionalizaciones
"El reforzamiento inmediato puede ser especialmente útil cuando estás tratando con hábitos de evasión, que son conductas que quieres dejar de hacer.",evasión
El acto de tomar tu teléfono para ver los mensajes queda asociado con la señal de aviso que emite tu teléfono.,aviso
Nos gustan los pendones y las medallas en nuestras chaquetas.,pendones
"Esto se debe a que las zonas que están dentro de la misma latitud generalmente comparten climas similares, cambios de estación, así como la misma cantidad de luz solar y de lluvia.",latitud
"Manejar al gimnasio, hacer cinco minutos de ejercicio y salir del gimnasio.",Manejar
"◆	Entre más ritualices el principio de un proceso, más posibilidades hay de que acabes por alcanzar el estado de concentración profunda que se requiere para alcanzar grandes logros.",acabes
Celebramos juntos.,Celebramos
"En muchos casos, pensarás que tu hábito es muy complicado y tendrás que hacerlo sencillo.",pensarás
Los planes nuevos ofrecen esperanza por no tenemos experiencias que nos permitan anclar nuestras expectativas en la realidad.,permitan
"Por fin, un día se tocan nuevamente, de la misma manera en que lo estuvieron haciendo durante varias eras, pero en esta ocasión la presión es demasiada.",tocan
Dale a tus hábitos un tiempo y un lugar para habitar en este mundo.,habitar
"Los restos más antiguos del hombre moderno, conocido como Homo sapiens, tienen aproximadamente 200 000 años.12 Estos fueron los primeros seres humanos que tuvieron un cerebro relativamente similar al nuestro.",Homo
Seleccionamos nuestros hábitos de la gente que nos rodea.,Seleccionamos
Las colonias de mosquitos florecían en los charcos de agua estancada y los niños jugaban en medio de la basura.,colonias
•	«Correr tres millas» equivale a «Amarrarme las agujetas de los tenis».,Amarrarme
Estás apropiándote de toneladas de nueva información y tratando de organizarla para que tenga sentido.,apropiándote
Lo dejamos al azar y esperamos que «nos acordaremos de hacerlo» o nos sentiremos motivados cuando llegue el momento correcto.,acordaremos
"Esto puede tener como resultado un «abismo de desilusión», un punto en el que la gente se siente descorazonada tras haber puesto semanas o incluso meses de trabajo duro sin experimentar ningún resultado aparente.",descorazonada
"Por el contrario, Robins reveló que las adicciones podían disolverse espontáneamente si ocurría un cambio radical en el ambiente.",disolverse
El placer le enseña a nuestro cerebro que una conducta vale la pena ser recordada y repetida.,recordada
Departamentos enteros están dedicados a mejorar la manera en que un producto se siente en tu boca —una cualidad que se conoce como orosensorial—.,enteros
"El año durante el cual estuve escribiendo mi libro, experimenté con una estrategia de gestión de tiempo.",experimenté
"8	Podría jurar que leí esta frase en algún lugar o tal vez es una paráfrasis de algo semejante, pero a pesar de mis mejores esfuerzos, no logré encontrar la fuente original.",jurar
"Y al contrario, si nunca revisas tus hábitos, es como si nunca te vieras al espejo.",vieras
"Y funcionó, pero no por razones económicas.",económicas
36-41 [Etología: Los mecanismos y la evolución de la conducta].,Etología
"3	B.F. Skinner, The Behavior of Organisms, Nueva York, Appleton-Century-Crofts, 1938.",Organisms
"Después de pasar cientos de miles de años cazando y recolectando comida en la naturaleza, el cerebro humano ha evolucionado hasta darle un valor muy elevado a los alimentos que contienen sal, azúcar y grasa.",cazando
Cada habitación tenía un uso primario.,primario
"16	Michael (@mmay3r), «The foundation of productivity is habits.",foundation
"Incontables personas han llevado un registro de sus hábitos, pero tal vez el más famoso sea Benjamin Franklin.2 Desde que cumplió 20 años, Franklin llevaba a todas partes una pequeña libreta donde registraba 13 virtudes personales.",virtudes
Determinaron el tipo de almohada y de colchón que brindaba más comodidad a cada competidor a la hora de dormir.,Determinaron
"El cáncer es indetectable el 80% del tiempo desde que surge hasta que, en un momento dado, en cuestión de meses, acaba con el cuerpo.18 El bambú apenas se alcanza a ver durante los primeros cinco años.",indetectable
¿Qué fue lo que hice justo antes de tener esa sensación?».,hice
"Los cambios empezaron siendo pequeños —un cultivo que empezó a extenderse un poco más lejos, la población que comenzó a multiplicarse a mayor velocidad—, pero al combinarse constituyeron diferencias importantes.",multiplicarse
[El efecto de las dietas bajas en carbohidratos versus las dietas bajas en grasas en procesos de pérdida de peso de 12 meses de duración en adultos obesos y su asociación con patrones genotípicos y la secreción de insulina].,obesos
"Sin tener ningún tipo de ropa para salir de casa, tuvo que permanecer en su estudio donde escribió furiosamente durante el otoño e invierno de 1830.1 El jorobado de Nuestra Señora de París fue publicado dos semanas antes del plazo, el 14 de enero de 1831.",furiosamente
La mente consciente le pasa a la mente inconsciente las tareas para que las ejecute de manera automática sin hacer uso de la conciencia.9 Eso es justamente lo que pasa cuando se forma un hábito.,ejecute
"Si no tienes buenos hábitos de estudio, siempre vas a sentir que el resto de la clase te deja atrás.",deja
RESUMEN DEL CAPÍTULO,CAPÍTULO
"Sin variedad, nos aburrimos.",aburrimos
"Por otro lado, los alumnos que estaban sentados del lado derecho, formarían parte del grupo «cualitativo».",cualitativo
Tus hábitos son justamente una serie de soluciones automáticas que resuelven los problemas y presiones que enfrentas regularmente.,soluciones
Inhala profundamente tres veces y sonríe.,Inhala
Puedo ver al animal y darme cuenta de cuándo estoy estimulando su sistema de BÚSQUEDA porque comienza a explorar y olfatear».,estimulando
"Con frecuencia, nos convencemos a nosotros mismos de que un enorme éxito requiere una acción igual de relevante.",convencemos
"Los hábitos son atractivos cuando los asociamos con sentimientos positivos, y es posible usar este conocimiento a nuestro favor en lugar de aplicarlo en detrimento de nosotros mismos.",aplicarlo
3	Christopher J. Bryan et al.,Christopher
"En un suburbio cercano a Ámsterdam, descubrieron que algunos colonos usaban 30% menos energía que sus vecinos, a pesar de que las casas eran de tamaño similar y pagaban lo mismo por la energía eléctrica.",colonos
La primera es abrir más la válvula que libera el agua.,válvula
* Tengo una teoría predilecta acerca de lo que sucede cuando alcanzamos el estado de flujo.,predilecta
"6	«Policymakers around the world are embracing behavioural science», The Economist, 18 de mayo 2017, https://www.economist.com/news/international/21722163-experimental-iterative-data-driven-approach- gaining-ground-policymakers-around [Legisladores de todo el mundo están adoptando la ciencia conductista].",Policymakers
"Todos tenemos metas que nos gustaría lograr y sueños que queremos cumplir, pero sin importar en qué estás tratando de ser mejor, si solo te esfuerzas y haces el trabajo cuando te resulta conveniente y emocionante, entonces nunca serás lo suficientemente consistente como para alcanzar resultados destacados.",destacados
"Después de algunos encuentros, él empezó a evitarla a ella porque le parecía anodina.11",evitarla
Finalmente dividimos 29 entre los 33 minutos jugados.,dividimos
Señal: Observas que la luz del semáforo cambia a verde.,semáforo
"El mantra que encuentro útil en estos casos es: «Un solo lugar, un solo uso».",mantra
"El historial de hábitos naturalmente construye una serie de señales visuales, como la cadena de equis en tu calendario o la lista de comidas en tu diario de alimentación.",equis
"Anne Thorndike, doctora de cuidados primarios en el Hospital General de Massachusetts en Boston, tuvo una idea genial.",cuidados
Magic también tenía crédito por un acto heroico no reconocido que consistió en lanzarse por una bola suelta (+1).,heroico
CÓMO AUTOMATIZAR UN HÁBITO Y NUNCA PENSAR EN ÉL OTRA VEZ,PENSAR
"De esa forma, cuando quieras sentir ganas de tener sexo, lo único que tienes que hacer es oprimir la tecla de encendido en el equipo de sonido.",tecla
Los recibos se guardaban en un cajón abierto y podían alterarse o tirarse fácilmente.,guardaban
"Yo había jugado beisbol desde que tenía 4 años, y para alguien que había dedicado tanto tiempo y esfuerzo a un deporte, haber sido rechazado del equipo principal había sido muy humillante.",humillante
"La acumulación de hábitos, que revisamos en el Capítulo 5, vincula tu hábito a una señal inmediata, que vuelve evidente el momento de empezar.",revisamos
"Para empezar el experimento, diseñó una colección de picos falsos de cartón que consistían solamente en una cabeza sin el cuerpo.",falsos
Y la única estrategia de superación personal que tiene sentido es enfocarse en aquello que se puede controlar.,enfocarse
Dejaron de comer y de tomar agua.,Dejaron
"Preocuparte por tu salud te hace sentir ansioso, lo cual provoca que fumes por ansiedad, lo cual hace que tu salud se deteriore aún más y pronto te sientas más ansioso.",Preocuparte
"Después de este período inicial de exploración, cambia tu enfoque y dirígelo hacia la mejor solución que encuentres —pero sigue experimentando y probando ocasionalmente.",dirígelo
Solamente creaban una sensación de tener la boca limpia y fresca y hacían la experiencia de lavarse los dientes mucho más disfrutable.,creaban
"Tal cantidad de suscriptores está tan lejos de las expectativas que tenía cuando inicié el sitio, que ni siquiera estoy seguro de lo que debo pensar acerca de él.",pensar
"Entre más inmediato y costoso es un error, más rápido aprenderás de él.",aprenderás
El proceso de formación de hábitos empieza con una secuencia de ensayo y error.,secuencia
"Después de regresar de comer, llamaré a tres clientes potenciales (lo que necesito).",potenciales
"Cuando aprendes los movimientos básicos tan bien que puedes desempeñarlos sin pensar, entonces estás libre para poner atención a detalles más avanzados.",desempeñarlos
"Una decisión que anteriormente requirió un esfuerzo, ahora se ha vuelto automática.",requirió
"Hoy en día, en los Estados Unidos de América, usar un cinturón de seguridad es una ley obligatoria en 49 de los 50 estados que lo conforman.3 Y no solo se trata de la legislación, el número de personas que usa los cinturones también ha cambiado dramáticamente.",dramáticamente
•	Productividad: La navegación por las redes sociales puede eliminarse con un bloqueador de sitios web.,eliminarse
"Él había ofrecido mostrarme los alrededores mientras yo estaba en el país, y yo acepté su oferta.",mostrarme
Brailsford solía afirmar: «El principio de esta filosofía consiste en aislar cada uno de los aspectos del ciclismo.,aislar
"De hecho, la palabra identidad originalmente se deriva de los términos en latín essentitas, que significa ‘ser’ o ‘existir’, e identidem, que significa ‘repetidamente’.",essentitas
"12		S. Thompson, J. Michaelson, S. Abdallah, et al.",Thompson
Estas tácticas pueden hacer que el historial o registro de hábitos sea más sencillo.,tácticas
"Actualmente, más del 88% de los estadounidenses se abrochan el cinturón cada vez que se suben a un automóvil.4 En poco más de treinta años, se dio un giro a los hábitos de millones de personas.",abrochan
•	Reducir la incertidumbre.,incertidumbre
"Para más información, véase Daniel Goldstein, «The battle between your present and future self», TEDSalon NY2011, noviembre 2011, video, https://www.ted.com/talks/daniel_goldstein_the_battle_between_your_present_and_future_self [La batalla entre tu yo presente y tu yo futuro].",battle
Llamaron a su cuenta de ahorros «Viaje a Europa».,Llamaron
Un público de 18 695 espectadores llenó su presentación en Ohio.,llenó
Abordar una situación desde una posición emocional más neutral te permite basar tu respuesta en los datos más que en la emoción.,Abordar
¿Por qué alguien comería en exceso si sabe que hacerlo incrementa el riesgo de sufrir obesidad?,comería
"Sigues comiendo botanas, aunque ya te sientes satisfecho.",Sigues
La reflexión y la revisión habilitan la mejora a largo plazo de todos los hábitos porque te hacen consciente de tus errores y te ayudan a considerar diversos caminos para lograr una mejora.,habilitan
Ese pequeño cambio apenas se notaría durante el despegue.,notaría
15	Los investigadores posteriormente descubrieron que las endorfinas y los opioides eran responsables de las respuestas de placer.,endorfinas
Los servicios de transportación compartida reducen la tensión que produce ir de un lugar a otro en transporte público.,transportación
"Iba al gimnasio, hacía ejercicio durante cinco minutos y se iba en cuanto terminaba.",Iba
◆	Es menos probable que repitamos un mal hábito si este es doloroso e insatisfactorio.,repitamos
"En su lugar, tomar un baño de burbujas o salir a pasear por placer son buenos ejemplos de cómo recompensarte a ti mismo concediéndote tiempo libre, lo cual se alinea con tu objetivo último de tener más independencia financiera.",pasear
La persona promedio pasa más de dos horas al día en las redes sociales.7 Piensa qué harías si tuvieras 600 horas extra por año).,harías
"Entre más vinculado esté el nuevo hábito a una señal específica, más posibilidades habrá de que te des cuenta de que ha llegado la hora de realizar la acción.",vinculado
Simplifican el proceso para crear una cuenta.,Simplifican
CÓMO APLICAR ESTAS IDEAS A LOS NEGOCIOS,NEGOCIOS
Las leyes laborales de aquella época eran más laxas que ahora y el niño logró conseguir un empleo vendiendo guías por 50 centavos de dólar cada una.,laxas
"Estoy en deuda con Shane Parrish, quien precedió mis pensamientos sobre este tema cuando escribió sobre el porqué «evitar la estupidez es más sencillo que intentar ser brillante».",precedió
"Con suficiente práctica, es posible seleccionar las señales que predicen ciertos resultados sin pensar conscientemente en ello.",seleccionar
"Cuando entré en coma, el hospital envió a un sacerdote y a una trabajadora social para confortar a mis padres.",envió
"La semilla de cada hábito es una pequeña decisión.21 Pero conforme esa decisión se repite, un hábito nuevo surge y se va fortaleciendo.",fortaleciendo
Asch aplicó este experimento en muchas ocasiones y de distintas maneras.,aplicó
"Ronan Byrne, un estudiante de ingeniería eléctrica de Dublín, Irlanda, disfrutaba de ver Netflix, pero también sabía que debía hacer ejercicio con más regularidad.",Ronan
Mi cuerpo era incapaz de soportar la rápida inflamación de mi cerebro y perdí la conciencia antes de que la ambulancia llegara.,perdí
3.	Extraversión: de activo y sociable a solitario y reservado (probablemente los conozcas como introvertido versus extrovertido).,Extraversión
Planeta de libros,libros
